|question|ps_0|ps_1|ps_2|right_answer_id
1456|Около 95% пресной воды в США - под землей. Как называется самый большой источник пресной воды в США?|Озеро Улучшенный водоносчик|горизонт Огаллала|Тампа горизонта|1.0
1457|На какую китайскую реку - 2335 метров (7660 футов) длинные и 185 метров (616 футов) высокие три ущелья плотины?|Хуан он|Янцзы|Жемчужная река|1.0
1458|Контроль реки Ганга, священно к некоторым людям, был очень спорен между какими двумя народами?|Индия и Бангладеш|Индия и Мьянма|Индия и Пакистан|0,0
1459|Чистая вода, если она существует, имеет этот pH.|7|1|14|0.0
1460|Существует высокие приливы и низкие приливы в больших водоемах на земле. Какое утверждение верно в приливах?|Тиды вызваны рентгеновскими лучами, не гравитацией.|Приливы вызваны гравитационным эффектом только солнца.|Приливы вызваны гравитационными силами как Луны, так и Солнце.|2.0
1461|Удивительно, но правда, что иногда горячая вода может заморозить быстрее холодной воды. Что называется этот эффект?|Эффект deplembes|эффект MPEMBA|эффект Фурье|1.0
1462|Что означает научный термин Virga?|Эффект на Марс, который делает его, как будто вода была на Марсе|дождь, который никогда не попадает на землю|соль, которая остается после морской воды, была опреснена|1.0
1463|Доказано, что пить только в бутылках воды может иметь это влияние на ваше здоровье.|Увеличение жира в организме|Увеличение веса|Увеличение проблем стоматологии|2.0
1464|Венера названа в честь римской богини того, что?|Правда|Похоть|любовь|2.0
1465|Венера путешествует по солнцу в среднем расстоянии, сколько миль?|120 миллионов миль|67 миллионов миль|1,2 миллиарда миль|1.0
1466|Венера имеет самую плохую атмосферу солнечной системы. Какой газообразный элемент содержит основную часть атмосферы?|Кислород|неон|диоксид углерода|2.0
1467|Из-за парникового эффекта Венера оказывает самая горячая температура поверхности в солнечной системе. Какова средняя температура на Венере?|120 градусов C.|135 градусов C.|460 градусов C.|2.0
1468|В чем разница между воздушным шаром и зеппелен?|Воздушный шар может подняться только вверх и вниз; он не может идти на восток-запад или левый справа.|Zeppelin имеет пилоты или пилоты или пилоты или пилоты под заполненной газовой камерой.|Zeppelin имеет жесткую рамку вокруг воздушного шара, содержащего газы.|2.0
1469|В 1883 году Отто Лилиентхал стал первым человеком, чтобы успешно летать на самолете этого типа.|Термотвестный|планер|Граф Zeppelin|1.0
1470|Аэропорт Schiphol является основным аэропортом этого города.|Брюссель|Берлин|Амстердам|2.0
1471|Кто был первым человеком, чтобы летать соло без концов во всем мире в воздушном шаре?|Генрих Кубис|Стив Фоссетт|Ричард Рутан|1.0
1472|Как быстро машина 1?|1207 километров в час|1207 метров в час|1207 футов в секунду|0.0
1473|В 1956 году бизнесмен Tennessee David Flexer имел эту отличную идею.|У авиакомпании транспортные пакеты на длинные рейсы|показать фильмы на авиабилеты|построить сверхзвуковой самолет|1.0
1474|В каком году был первым входным питанием?|1969|1949|1919|2.0
1475|В 1938 году Дуг Криган отправился на рейс из Нью-Йорка в Калифорнию. Какой прозвище он получил после полета?|День / Ночь Криган|California Dreamncorrigan|Неправильный путь Корогун|2.0
1476|В каком году самолет впервые ударил в 200 миль в час?|1944|1922|1955|1.0
1477|Кто был первым сенатором США, чтобы летать на космическом трансфере?|Билл Брэдли|Джейк Гарн|Том Макмиллан|1.0
1478|Кто был первым актером, чтобы достичь звания бригадного генерала в ВВС США?|Уильям Бендикс|Кирк Дуглас|Джеймс Стюарт|2.0
1479|Какое различие удерживает Деннис Тито?|Он был первым туристом в космосе. Он был первым, кто вылетает шаттл, стрелял вниз по боестре противника и летал на воздушном шаре через Атлантику.|Он был первым, кто выступил на трансфер три раза.|0,0|
1480|Какая из этих частиц имеет отрицательный заряд?|Нейтрон|электрон|proton|1.0
1481|Этот человек предоставляется кредит на охвату термин, занимающийся серфингом в Интернете.|Марвин Минский|Тим Ли-Берерры|Джин-броня Полли|2.0
1482|Кто помог придумать блендер?|Carl Sontheimer|Реже Варенение|Carl Frederick Winson|1.0
1483|Какой самый высокий слой атмосферы Земли?|Икосфера|Эктосфера|экзосфера|2.0
1484|Какая из этих единиц для расстояния - самое длинное?|1 pare sec|1 светлый год|1 галактический год|0,0
1485|Найти правильное утверждение о циклонах.|Циклоны всегда несут горячий воздух. В северном полушарии циклоны движутся в направлении против часовой стрелки.|Циклоны являются системами высокого давления.|1.0|
1486|Какие из следующих терминов описывают темный слой облаков, которые приносят дождь или снег?|Stratocumulus|Cirrrus|NimboStratus|2.0
1487|Это синоним нейтронной звезды.|Белый гнома|черная дыра|пульсар|2.0
1488|Ученые используют это животное, чтобы попытаться найти вакцину для проказы.|Armadillos|Яд Дартские лягушки|Морские еры|0,0
1489|Что такое самый легкий элемент, который является металлом?|Титан|Литий|Кобальт|1.0
1490|В математике и науке двойная тильда часто используется в качестве символа. Который символизируется двойной тильдой?|Имеет тот же атомный номер, что и|имеет то же самое первое производное, как|примерно равен|2.0
1491|Динозавры можно разделить на две группы: орниты и саришцы. Разница между ними в основном в структуре этой части их тел.|Глаза|бедра|зубы|1.0
1492|Какая из этих живых существ появилась на земле первым?|Рыба|рептилии|семенные растения|0,0
1493|Что было произведено животное в знаках Миссии Аполлона 11, первой миссией, чтобы приземлиться человеком на Луне?|Ястреб|орел|медведь|1.0
1494|Как было название командного модуля APOLLO 11?|Колумбия|Орел|Грузия|0.0
1495|Какая из трех астронавтов из APOLLO 11 оставалась в командном модуле, в то время как два других разделены вместе с лунным модулем?|Нил Олден Армстронг|Майкл Коллинз|Эдвин Евгений Бузз Альдрин, младший|1.0
1496|Как Edwin Eugene Buzz Aldrin, Jr. Получить свой псевдоним Buzz?|Ему дали этот прозвище, потому что он был инженером.|Его сестра дала ему.|Он был чрезвычайно разговорчивым как ребенком, к тому, чтобы быть раздражающим.|1.0
1497|Какая из трех астронавтов из Аполлона 11 потеряла ребенка в 1962 году?|Иллинз, так и Армстронг|Нил Армстронг|Эдвин Евгений Бузз Алдрин, младший|1.0
1498|Какая из этих объектов астронавты из Аполлона 11 остаются на поверхности Луны во время их миссии?|Две рисунки западных и восточных полушарий Земли|все эти|подпись американского президента и их собственные подписи|1.0
1499|BUZZ ALDRIN» создал гостевой вид звезды в эпизоде Симпсонов. Какой его комментарий, когда Гомер Симпсон не показал, что он не признал его второго человека, чтобы ходить по Луне?|Второй приходит сразу после первого!|Эй, я был только вторым поздним!|Я известный, остальные это история.|0.0
1500|1 мая 2009 года три астронавта из Аполлона 11 были предоставлены этой исключительной награды.|Все эти|Фиолетовое сердце|Золотая медаль Конгресса|2.0
1501|Электрокулография - это медицинская процедура, которая проверяет потенциал того, какой орган организма?|Сетчатка|Внутреннее ухо|надпочечники|0,0
1502|Сигмоидоскопия - это медицинское обследование того, какой внутренний орган?|Желчный пузырь|полость мозга|большая кишка|2.0
1503|Тимпанопластика - это тип реконструктивной хирургии, выполняемой на какой части тела?|Пальцы или пальцы|барабанчик|Череп кости|1.0
1504|Гениопластика или ментопластика - это процедура косметической хирургии, которая направлена на улучшение появления какой части тела?|Подбородок|ягодицы|гениталии|0.0
1505|Нефрэктомия - это хирургическое удаление того, какой внутренний орган?|Почка|щитовидная железа|поджелудочная железа|0.0
1506|Дебридирование - это медицинская процедура, которая вводится в этом случае?|Инфицированные ткани|присутствие мертвой ткани|все эти|2.0
1507|Первый успешный эксперимент с ядерным делением, процесс, в котором ядро атома расщепляется на два или более мелких ядра, было проведено в каком году?|1938|1932|1934|0.0
1508|Это год, в котором миры первая атомная электростанция, генерирующая электроэнергию для коммерческого использования, была официально связана с советской сеткой.|1954|1956|1953|0.0
1509|Это место, популярное как центр восстания виски, - это первый в мире ядерный город.|Сан-Диего, CA|Baltimore|Питтсбург, Пенсильвания|2.0
1510|Это 1903 лауреат Нобелевской премии, обнаружил радиоактивность в 1896 году.|Wilhelm Conrad Rontgen|Henri Becquerel|Elihu Thomson|1.0
1511|Международные масштабы ядерных событий, используемые для обозначения сорта ядерных аварий, имеют сколько уровней?|6|7|3|1.0
1512|Первый мирный ядерный взрыв (пневматический взрыв в США был проведен в каком году?|1960|1959|1961|2.0
1513|Что было кодовое управление первой термоядерной бомбой в США, проведенное в 1954 году?|Эксплуатация колесницы|Castle Romeo|Операция толстый человек|1.0
1514|Эта группа сплавов, которая представляет собой комбинацию по меньшей мере одного металла и одного или нескольких других элементов, используется для одетых топливных стержней на атомных установках.|Амальгама|Zircaloy|Hastelloy|1.0
1515|Этот американский физик был самым молодым руководителем Группы проекта Манхэттена, совместные усилия США и их союзников WW II для развития первого ядерного оружия.|Генри Дейфф Смит|Эдвард Теллер|Роберт Р. Уилсон|2.0
1516|Как зовут красный супергист, который отмечает orions правый плечо?|Betelegeuse|Taneriss|Беллатрикс|0.0
1517|Что из следующего является самой яркой звездой в зимнем ночном небе северного полушария?|Сириус|Procyon|Strebe|0.0
1518|Какие две звезды-близнецы в созвездии Близнецы?|Spica Arcturus|Castor Pollux|Voltron Yularis|1.0
1519|Северная звезда, полярис, расположена в пределах какого созвездия?|Ursa minor|ursa major|canis lupus|0.0
1520|Что такое созвездие Урса, обычно известная как?|Большой ковш|Великий рыбак|Лев|0.0
1521|Что из следующего не является созвездием зодиака (кольцо созвездий, которые солнце проходит через каждый год)?|Рыба|крылатая лошадь|краб|1.0
1522|Какой большой и очевидный летний астеризм делают Vega, Deneb и Altair?|Летний крест|летний шестрец|летний треугольник|2.0
1523|Сколько признанных созвездий на всей виду Земли?|244|88|106|1.0
1524|В каком году 23-летняя американская Clyde Tombaugh открывает плутон, или планету х, так как она была названа тогда?|1930|1878|1910|0.0
1525|Это неверное утверждение о функциях орбиты PluTo?В долгосрочной перспективе это хаотично.|В определенные моменты вовремя, он пересекает орбиту нептун.|Он склонен по сравнению с плоскостью других планет орбиты.|1.0|
1526|Что необычно о плутосе трех известных лун по сравнению с другими лунами в солнечной системе?|Они орбиты Pluoto на очень высокой скорости. Они являются астероидами из другой солнечной системы, привлеченной плутором и захваченным гравитационными силами.|Они невыразится близко к Pluto.|2.0|
1527|Какая функция будет развиваться, если размещена рядом с солнцем, как Земля?|Хвост комета|очень эллиптическая орбита|Ни один из них|0.0
1528|Реклассификация Плутона как карликовая планета в 2006 году вызвала возникновение того, что?|Risings среди астрономии преподают в США|новые этнические конфликты на Ближнем Востоке|Новое слово на английском|2.0
1529|В вирусологии, как называется термин?|Организм, который несет вирус, но не заражен этим|организм, зараженный вирусом|вирус, который не паразит на клетки, а живет самостоятельно|0,0
1530|Вирусные окаменелости от нескольких тысяч лет назад показывают, как насчет происхождения вирусов?|Ни один из них|они когда-то были маленькими клетками, которые жили паразитически на более крупных.|Они появились и развивались одновременно с жизнью на земле.|0,0
1531|Какая из них не является одним из методов, используемых вирусами, чтобы сделать ячеистую ячейку в новых выпущенных вирусах?|Апоптоз|подарок|вирус|2.0
1532|Первая неделя июня 2007 года была переработана сейчас неделя в Англии. Какие из этих событий были представлены в своей программе?|Строительство тюрьмы, сделанную из переработанных шин.|Красивые женщины, падающие в купальники, сделанные из переработанной стали.|Дети, демонстрирующие, как рециркулировать урана.|1.0
1533|В 2002 году исследовательская команда колледжа построила 42-футовый мост через реку Raritan. Какие были балки для моста?|Рециркулированные школьные стиратели|переработанные шины|переработанные полистирольные чашки и молочные контейнеры|2.0
1534|31 января 2008 года, Китай объявил, что это будет рециркулировать их для резервуары дороги.|Робби Уильямс CD|Старые автомобили|Уголь|0,0
1535|Какая из этих компаний переработала старые кроссовки, чтобы сделать теннисные корты?|Banta|Nike|Adidas|1.0
1536|Исао Миеши» очень умный рециллер из Японии. Что он перерабатывал?|Pachinko Machines|рулетки колеса|зубные протезы|2.0
1537|Fiberfill используется, чтобы сделать лыжные куртки. Что может быть переработано, чтобы сделать достаточно Fiberfill для одной лыжной куртки?|384 фунта газеты|5 пластиковых содовых бутылок|1045 стаканчиков стирола|1.0
1538|Примерно какой процент отходов Америки - это бумаги?|39%|14%|8%|0,0
1539|Диоксид углерода является очень распространенным загрязнителем. Примерно насколько углекислый диоксид производится у среднего американца каждый год?|22 тонны|5 тонн|93 тонны|0.0
1540|В Суссекс, Англия компания ECOPOD компания использует переработанную бумагу, чтобы сделать их.|Гроки|Пищевые канистры|Квартиры|0.0
1541|Какая отец-дочь кинозвезды, как на экране отец и дочери Моисея и ади в кинотеатр Луны?|Ни один из них|Пол Ньюман и Нелл Поттс|Райан Инал и Татум Универ|2.0
1542|Какая песня, включенная на розовый флайдский концептуальный альбом темная сторона луны, содержит следующие тексты песен:|D Гонки вокруг, чтобы снова подняться позади тебя|E Sun одинаково в относительном способе, но ты старше|рта дыхания и однажды ближе к смерти?|
1543|Саундтрек для тех из этих фильмов не включает популярную песню Blue Moon, написанную Ричардом Роджерсом и Лоренцем Харт?|Смазка|горькая луна|голубая луна (2002)|1.0
1544|Какая академия, выигравшего наградами европейским директором и направленным на драму фильма горькую луну, в главной роли от Петра Койот?|Эмир Кустюрика|Милос Форман|Роман Полански|2.0
1545|Какой австралийский поп-дуэт выполнил 1990-е годы, ударил на Луну и обратно?|Ищущие|Дикий сад|Soundgarden|1.0
1546|Имя Сэмюэл Коллериджи длинное стихотворение, которое содержит линии:|D нигде не соблазнил. Оримы древнего моряка|Переимия древнего моряка||
1547|Какая актриса выиграла награду академии за лучшую актрису для изображения Loretta Castorini в романтической комедии Moonstruck?|Олимпия Дукакис|София Лорен|Шер|2.0
1548|Людвиг Ван Бетховен включал итальянскую фразу, Quasi Una Fantasia в названии его фортепиано Соната № 14, популярно известный как лунный соната. Что эта итальянская фраза означает на английском языке?|Просто фантазия|почти фантазия|чистая фантазия|1.0
1549|Назовите альтер эго Marvel Comics Вымышленное персонаж Луны Рыцарь.|Marc Spector|Victor Spector|Стив Роджерс|0.0
1550|Что такое средняя скорость роста нормальных волоковых фолликулов на человеческой кожи головы?|1 мм в день|100 мкм в день|400 мкм в день|2.0
