|question|ps_0|ps_1|ps_2|right_answer_id
1085|Какую масштаб измеряет сексуальную ориентацию от 0 (исключительно гетеросексуал) до 6 (исключительно гомосексуал?|Масштаб Johnas|Шкала Киндси|Масштаб Джеймса|1.0
1086|Тропический шторм с устойчивым ветрами, превышающими 33 метра в секунду, что происходит на северо-западе Тихого океана к западу от Datheline, называется этим.|Тяжелый тропический циклон|ураган|тайфун|2.0
1087|Одним из факторов, необходимых для формирования тропического циклона, является теплой поверхностью моря до определенной глубины. Как минимум, насколько теплее должна быть поверхность моря и на какую глубину?|5,5 C (41,9 F) на глубину 100 метров (328 футов)|15 C (59 f) на глубину 25 метров (82 футов)|26,5 С (79,7 е е) на глубину 50 метров (164ФТ)|2.0
1088|Всемирно, тропические пики циклонные пики к концу какого сезона и почему?|Лето, потому что температура воды самые теплые|Весна, из-за быстрой герма воды|падение, как температура быстро падает, воды остаются теплыми|0,0
1089|Расширение масштабов Фудзиты - интенсивность торнадо, ущерб, который он наносит нанесение людей, построенных в состав, этот масштаб классифицирует ураганы путем интенсивности их устойчивых ветров.|Saffir-Simpson Scale|Шкала Бофорта|Шкала Кардашева|0.0
1090|Какое из следующих утверждений лучше всего описывает штормовый порядок?|На берегу воды, связанного с системой погоды с низким давлением|внезапное и быстрое увеличение интенсивности шторма|расширение ураганов глаз|0,0
1091|Анемометры, от греческого слова анемос, означающие ветер, можно использовать для измерения этого.|Ветры Давление и скорость|Власти влаги и скорость|Ветер скорость|0.0
1092|Какие из этих экономических терминов не обозначают ограничение международной торговли, то есть свободный поток товаров между народами?|Торговые квоты|Общее соглашение о тарифах и торговле|нетарифные торговые барьеры|1,0
1093|Каким фактором является причиной для экономистов полагать, что страны постепенно становится более экономически взаимозависимым?|Есть много многонациональных корпораций, которые проектируют, производствуют и продают продукты по всему миру.|Глобальная торговля в значительной степени помогает постоянному прогрессу технологии.|Все эти|2.0
1094|Международная торговля является важной частью мировой экономики. Какое утверждение о международной торговле не соответствует действительности?|Глобализация - это процесс, тесно связанный с международной торговлей.|Большие страны зависят от торговли, чем меньшие страны.|Коммунистические и социалистические народы, как правило, стремятся к совершению отсутствия международной торговли (Аутрки).|1.0
1095|Предположим, что увеличение цены хорошего Y приводит к увеличению спроса на хороший X. Это явление является примером того, какой эффект в экономике?|Эффект дохода|эффект питания|эффект замещения|2.0
1096|Имея в виду законные законы о спросе и снабжения, что будет с равновесием цен и количества автомобилей, если заработная плата работников производства их увеличивается?|Цена будет увеличена; количество будет уменьшаться.|Цена будет уменьшаться; количество увеличится.|Цена увеличится; количество увеличится|0,0
1097|Эластичность - это термин экономической экономикой, который относится к пропорциональному изменению двух переменных, связанных друг с другом. Например, если вы зарабатываете 80 000 долларов в год и используете услугу кабельного телевидения, которые стоит вам на 100 долларов в год, ваш спрос на кабельную услугу?скорее всего, будет тем, что?|Inelastic|совершенно неупругий|эластичный|0,0
1098|Феномен, который ведет индивидуальные потребители и производители до равновесия с рынком, определяется, какой термин в экономике?|Невидимая рука|проблема свободных всадников|цена потолок|0,0
1099|Эффективная минимальная цена, налагаемая правительством, называемым ценовым этажом в экономике, обычно ожидается, что приведет к тому, что?|Избыток|Увеличение спроса|Снижение поставки|0,0
1100|Какая ближайшая звезда на солнце?|Deneb|Vega|Proxima Centuori|2.0
1101|У того, сколько приблизительных степеней венеры появляются с солнца?|78|35|46|2.0
1102|Назовите точку, где объекты орбиты проходят через плоскость орбиты земной орбиты.|Узел|Apogee|Измелость|0.0
1103|Как называется группа небесной сферы, сосредоточенной на эклиптике и окружающей неба?|Vernal Equinox|Зодиак|Фотосфера|1.0
1104|Что такое перигелион?|орбитальная точка ближайшего подхода к Солнцу|орбитальная точка наибольшего расстояния от солнца|затемнение луны, когда она движется через тень земли|0.0
1105|Как долго может длиться от всего лунного затмения?|1 час 40 минут|4 часа 30 минут|2 часа 30 минут|0,0
1106|Коралловый остров, состоит из кораллового рифа, ограждающий депрессию в центре, называется этим.|Патч|атолл|лагуна|1.0
1107|Что случилось с тропическими коралловыми рифами в течение погодных феноменов в 1998 и 2004 годах Эль Нино?|Многие из них были отбелены или даже убиты|некоторые из них взорвали|все они процветали|0.0
1108|Эта страна - крупнейший в мире экспортер кораллов.|Индия|Австралия|Индонезия|2.0
1109|Это естественный метод заживления, который использует рефлексные точки ног, которые соответствуют разным органам и участкам тела.|Рефлексология|восточная массажная терапия|ароматерапия массаж|0,0
1110|Что является наиболее распространенной причиной получения массажа?|Расслабление|боль в суставах|исцеление|0.0
1111|Гладкие штрихи усиливаются этим веществом, которое часто используется во время массажа.|Масло|Масло|Духи|1.0
1112|Как массаж расслабляет тело, снимает боль и уменьшает стресс, он способствует этому.|Лучший сон|рост волос|сильнее кости|0,0
1113|Это новый тип массажа, представленный в 1990 году Hemi Hoani Fox. Это происходит от танца Hawaiian Lomi-Lomi Nui и считается увеличением потока энергии внутри тела и ума.|Массаж Ма-Ури|Чжи Массаж Zhi Ya|Tui Na Massage|0.0
1114|В этом году массажная терапия и кузов были официально предложены впервые как основное медицинское обслуживание, в Атланте, ГА.|1990|1999|1996|2.0
1115|На начало нового тысячелетия это было приближенное количество американцев, которые ежегодно получают массаж.|15 000|150 000|20 000 000|2.0
1116|Что является преобладающим настроением человека с беспокойством?|Гнев|грусть|страх|2.0
1117|Какие из следующих людей, как правило, при высочайшем риске самоубийства?|Депрессия домохозяйка с ребенком для инвалидов|тревожный биржевой букер|разведенный, безработный человек, живущий в одиночку|2.0
1118|Какая из следующих лекарств эффективна как для депрессии, так и для беспокойства?|Buspar (Buspirone)|Paxil (Пароксетин)|Xanax (Альпразолам)|1.0
1119|Депрессия и беспокойство считаются расстройствами настроения. Что из следующего также считается расстройством настроения?|Биполярное расстройство|шизофрения|шизотиповое расстройство личности|0,0
1120|Какая из следующих расстройств не является формой тревоги?|Циклотика|Дизморфное расстройство тела|соматизационное расстройство|0,0
1121|Из следующих лекарств для беспокойства, которая потенциально захватывает?|Prozac (Флуоксетин)|Ативан (Лоразепам)|Buspar (Buspirone)|1.0
1122|Какая система человеческого тела обеспечивает сайт для образования клеток крови?|Сердечно-сосудистые|скелет|по договорной цене|1.0
1123|Цикл жизненного цикла - это серия изменений, которые ячейка проходит с того времени, когда оно образуется до тех пор, пока он не воспроизводит себя. Он включает в себя два этапа. Каковы эти два этапа?|Интерфазы и цитокинес|цитокинес и митоз|дивизия клеток и межфазные|2.0
1124|Костные поверхности не безликих и гладкие, но шрамы с массивом ударов, отверстий и хребтов, называемых маркировкой кости. Как называется маркировка кости, которая очень большая, тупые и нерегулярно в форме?|Crest|бугоркость|Trochanter|2.0
1125|Если я поверхностные мышцы человеческого тела, имея два выдающихся живота, то где я находился?|Нога|бедра|голова|0.0
1126|В организме человека легочная циркуляция различается во многих отношениях от системного циркуляции, потому что она не обслуживает метаболические потребности тканей организма. Что из следующего является истинной последовательностью легочной циркуляции?|Легочный ствол - левая легочная артерия - артерия левого левого легкого - правый атриум - правая легочная артерия - левый желудочек|правый атриум - правый желудочек - легочные артерии - артериолы - капилляры - венелы - леговые вены - левый атриум - левый желудочек|Левый желудочек - левое легкое - правое легкие - артерии лобара левого атриума - легочный ствол|1,0
1127|Как называется мониторы плоских панелей, которые стали все более популярными около 2005 года?|Dlp|ЖК-дисплей|Плазма|1.0
1128|Как называется порт, используемый для подключения периферийных устройств (таких как клавиатуры, мусор и цифровые камеры) на компьютер?|USB|Джек|дисководки|0.0
1129|Какой из них является операционной системой?|Norton Антивирус|Office - Professional Edition|Vista|2.0
1130|Какие возможности указаны, когда спецификации читают DVD ± RW / CD-RW?|Нет никаких возможностей. Это язык программирования.|Есть два диска дисков, один для DVD и один для CD.|Компьютер умеет читать и переписать CDS и DVD.|2.0
1131|Компании Intel и AMD в первую очередь известны своим развитием и изготовлением того, что?|Процессоры|Видеокарты|Программное обеспечение|0.0
1132|Какие из следующих типов клеток мозга усиливают нейронные сигналы и поддерживают гомеостаз?|аксоны|глиальные клетки|нейроны|1.0
1133|Что из следующего является частью лобной доли, область на передней части каждого полушария головного мозга?|Фузриформерная гир|Cingulate Sulcus|Precentral Gyrus|2.0
1134|Что из следующего не является частью группы артерий, снабженных мозгом, известным как круг Уиллиса?|передняя связь артерия|базилярная артерия|внутренняя сонная артерия|1.0
1135|Есть двенадцать черепных нервов, два из которых не присоединяются к мозговой штуцере. Какие эти два нерва?|Вершина челюсти и нижняя мандибулярная|Vagus и аксессуар|Обонятельная и оптическая|2.0
1136|Что из следующего является частью мозговой штуцевой, стебля мозга ниже знаменитых гемишпсов?|neocortex|Телецефанон|Понс|2.0
1137|Фред Гейдж и Питер Эрикссон обнаружил и объявил, что взрослый человеческий мозг производит новые клетки мозга. В каком году они сделали свое открытие?|1998|1992|1997|0.0
1138|Какая часть мозга, расположенная внутри временной доли, связана с формированием памяти?|гиппокамп|субталамус|Amygladala|0.0
1139|Эта эволюционная теория, предложенная неповторимым Стивеном Дж. Гулд и Нилдридж, утверждает, что эволюция возникает не постепенно, но быстро после периодов стаз и в изолированных, локализованных областях.|Случайное генетическое дрейфу|эволюция попкорна|пунктуал равновесие|2.0
1140|Это три миллиона летнее скелет, известное как Люси », было обнаружено в 1974 году и почти на 40% полное. Люси была маленькой, похожим на шимпанзе гоминид, но ходила в прямом эфире, как современные люди. Она является членом этого вида.|Homo Floresiensis|australopithecus afarensis|peking женщина|1.0
1141|Какова общая коллекция чертов, которые определяют физические и поведенческие аспекты организма?|Аллель|фенотип|ДНК маркеры|1.0
1142|До теории Дарвина самая влиятельная линия мысль в отношении разнообразных форм жизни стала учение креационистов, которая сравнила биологические функции в организме к сложным работам часов. Какой христианский аполог выдвинул аналогию часовщика?|Уильям Пейли|Сэр Ричард Докинс|Уильям Генри Грин|0.0
1143|Эволюционный процесс, где выгодные унаследованные черты становятся более распространенными в последующих поколениях организмов, а неблагоприятные менее распространенные, называются чем?|Натуральный выбор|случайный генетический дрейф|поток генов|0.0
1144|Этот монашеский EGGHEAD ведет исследование генетики, которые в конечном итоге объяснили механизмы видообразования посредством генетической мутации. Кто является отесом современной генетики? »|Джеймс Уотсон|Грегор Мендель|Жан-Баптист Ламар|1.0
1145|Moth Moth» - главный пример микроволюции, где цвет моли изменился на протяжении 200 лет, чтобы соответствовать сажу сундукам деревьев, которые он обитает. Темные мотыльки выжили, потому что они были менее заметными, чемИх белые коллеги к птицам, которые на них охотятся. Каков термин, связанный с изменением окраски, продемонстрированные в перцелевой моли?|Промышленный меланизм|революционная адаптация|натуральная пигментария|0,0
1146|Эти животные эволюционные линии - лучшее задокументированные и наиболее четко поняты.|Человек|лошадь|собака|1.0
1147|Во время своего знаменитого путешествия на острова Галапагос Чарльз Дарвин изучал различия в анатомии специфических животных, его наблюдения, устанавливающие сцену для его возможной теории эволюции. Какое анатомия животных сделала Дарвин?|Mockingbird Taulons|Обезьяна лапы|Finch Beaks|2.0
1148|Что из этого является выходным устройством, которое производит звуковой звук?|Принтер|Микрофон|Динамик|2.0
1149|В тригонометрии тангенс определяется как что?|Соотношение сторон, прилегающей к уголм, напротив угла|взаимный косинус|синус, разделенный на Cosine|2.0
1150|Что означает уравнение y = mx + b?|Гипербола|линия|парабола|1.0
1151|Что из них представляет собой локус точек, сумма чьих расстояний от двух заданных точек равна?|Эллипс|парабола|круг|0.0
1152|В геометрии, какова ценность номера, который представлен греческой буквой Pi (π)?Соотношение окружности окружности до его радиуса|соотношение окружности окружности до его диаметра|соотношение диаметра круга к его радиусу|1.0|
1153|Из-за отсутствия атмосферы, кратеры по большинству небесных органов от солнечной системы остаются сохранены в течение сотен миллионов или миллиардов лет. Самый большой известный кратер в Солнечной системе расположен на том, что натуральный спутник?|Луна|Titan|Deimos|0.0
1154|Больше, чем Pluto и Mercury, этот природный спутник - самая большая луна всей солнечной системы.|Titan|Callisto|Ganymede|2.0
1155|Какая планета с самым большим количеством натуральных спутников в солнечной системе?|Уран|Нептун|Юпитер|2.0
1156|Какая из четырех галилевых лун Юпитера отмечается как самый вулканически активное тело в солнечной системе?|Europa|IO|Callisto|1.0
1157|Именован в честь ведущих Sylph в Александре Popes Peem изнасилование замка, Луна Ариэль является натуральным спутником какой планеты Солнечной системы?|Юпитер|Уран|Нептун|1.0
1158|Это небесное тело является самым темным из Урана более крупных лун, и его самая отличительная особенность - это большое экваториальное кольцо яркого материала (предположительно кратер) по имени Вунда, который контрастирует с остальной частью темной поверхности планеты.|Умбриль|Оберон|Титания|0.0
1159|Что такое символ для водорода?|Hy|hr|h|2.0
1160|Что такое символ для неона?|Нет|nn|ne|2.0
1161|Что такое символ для серы?|SF|SU|S|2.0
1162|Что такое символ для висмута?|Bs|b|bi|2.0
1163|Что такое символ для платины?|Pt|pl|p|0,0
1164|Что такое символ для кадмия?|CM|CD|C|1.0
