|question|ps_0|ps_1|ps_2|right_answer_id
586|КИММЕТ, сложное технологическое достижение, является очень важным шагом в понимании выражений лица человека и их роли в социализации. Что на самом деле Кисмет?|Техника для повышения способности лица проводить эмоции|набор крошечных устройств, имплантированных под кожу, которые обнаруживают микроэксперты|общительный робот гуманоида|2.0
587|Какое эмоциональное состояние проходит жест суженных глаз?|Угроза, недоверие|удовлетворение, радость|грусть, разочарование|0,0
588|Этот орган содержит много бактерий, которые начинают переваривать окружающие органы сразу после смерти.|Печень|желудок|кишечник|2.0
589|Что из следующего происходит через три дня после момента смерти?|Тело начинает уменьшаться|тело начинает испускать запах|тело начинает набухать|2.0
590|Из-за вещества, присутствующего в этих структурах организма человека, они могут быть сохранены на протяжении веков, избегая разложения.|Зубы|гвозди|ресницы|0.0
591|Какая часть тела разлагается последним, но перед костями?|Хрящи|волосы|гвозди|1.0
592|Термин строгого Мортита означает это.|Жесткость смерти|опухший труп|синий труп|0.0
593|Смертная эрекция - это постпортированная эрекция, которая возникает, когда мужской человек умирает вертикально или лицом вниз. Что вызывает это состояние?|Иметь в общении до смерти|гравитация приводит к тому, что гениталии наполняются кровью|тело набухает|1.0
594|Расстояние между Луной и Земной примерно так сильно.|238 897 миль (384,467 км)|62 000 миль (100 000 км)|155,342 миль (250 000 км)|0,0
595|Луна меняет свою позицию, это отношение к земле. Каким образом?|Становиться ближе|двигаться по оси y земли y|уходит|2.0
596|Какой фактор гарантирует, что многие кратеры на поверхности лунов остаются хорошо сохранены по сравнению с тем на земле?|Сильные солнечные лучи|вращающееся движение|отсутствие атмосферы|2.0
597|Когда была создана луна?|Около 5,7 миллиардов лет назад|около 4,5 миллиардов лет назад|около 300 000 лет назад|1.0
598|Форма лун не совсем раунд. Что это похоже на?|Яйцо|киви|груша|0.0
599|Компас не может быть использован на луне. Какой фактор отвечает за это?Отсутствие магнитного поля|Влияние земной гравитации|Воздействие астероида|0,0|
600|Диаметр лун примерно так долго.|2,796 миль (4500 км)|2,154 мили (3,476 км)|5,567 миль (8,960 км)|1.0
601|Большая экспозиция в Королевской обсерватории, Гринвич посвящен хорологии, науке, которая изучает то, что?|время|навигация|Линзы|0.0
602|Этот вид, считающийся колонизированным почти каждой земной мазок на земле, изучается мирмекологией.|... Муравьи|Мухи|1.0|
603|Эта страна, известная для миров, длинная постоянная постоянно использованная пишущаяся система, является предметом изучения синологии.|Китай|Сингапур|Япония|0.0
604|Какие национальные символы предметом изучения Vexillology?|Флаги|Уплотнения|Национальные эмблемы|0,0
605|Что такое предмет изучения Танатологии, оференсив в греческой мифологии Танатосом?|смерть|чума|рождение|0.0
606|В каком термине используются ученые для обозначения постепенного утепления планеты из-за поглощения инфракрасного излучения в атмосферу?|Тепличный эффект|истощение озона|атмосферная термоусарежение|0,0
607|Эти биологические яды повреждают биосиологические системы при контакте. Травмы, которые они вызывают напоминают ожоги.|Оксидизеры|Галогениды|Агрессивные|2.0
608|Ассенское отравление в основном нарушает эту систему.|Сердечно-сосудистая система|пищеварительная система|эндокринная система|1.0
609|отравление этим веществом часто называют художниками колики.|Ведущий|Таллия|Барий|0,0
610|Три из этих змей продуцируют яд, смертельно для людей. Какой из них нет?|King Cobra|kingsnake пустыни|Мамба|1.0
611|После прочтения следующего, что будет доктор заключать? PT представляет 3 D S / P Turp, с C / O HA X 2 D.У пациента есть головная боль.|У пациента недавно была хирургия брюшной полости.|У пациента нет текущих жалоб.|0,0|
612|Что означает сокращения Rx, Tx, HX и SX?|Аптека, лечебная комната, больница и саниторин|почечная, щитовидная железа, матки и североапельки|рецепт, лечение, история и симптом|2.0
613|В медицинском Яргоне, что такое PMH, PSH, SH и FH?|Прошлая история болезни, прошедшая хирургическая история, социальная история и семейная история|пост-медицинское исцеление, постхирургическое исцеление, хирургическое исцеление и функциональное исцеление|задний средний хеид, задний верхний хитрый, поверхностный гиид и виногранный гиоид|0,0
614|Если доктор пишет, CNS 2-12 Intact, что из следующего было бы правдой?|Пациент - это мужчина.|Нервы шейки матки все функционируют нормально.|Пациент может закрыться и открыть глаза.|2.0
615|На медицинском языке, что такое ака?|Алкоголик|антибиотик|удаление конечности|2.0
616|Если доктор заказывает ЭКГ, какая часть тела будет рассмотрена?|Сердце|мозг|периферические нервы|0.0
617|в медицинском языке, fh: cad (m), dm (f) подразумевает что?|Мать пациенты умерла от аневризмы, и отец больных умер от инфаркта миокарда. У пациентов, у пациентов имел инсульт, и у пациентов, у пациентов был сахарный диабет.|2.0||
618|На вечеринке доктор спросил медсестра: вы Rn или LPN? Медсестра ответила: я Rn. Я получил свой BSN в Джорджтауне. Вы ответили, яДелать. Какие из следующих утверждений могут быть заключены из этого разговора?|Доктор собирается повезет сегодня вечером.|Доктор совсем не врач.|Доктор был обучен в остеопатических манипуляциях.|2.0
619|Эта наука изучает знаки, как индивидуально, так и сгруппированные в системах подписи.|Антология|семиология|Лингвистика|1.0
620|Какая часть человеческого тела изучает научную пародонтию?|Десны и рот|глаза|палец и пальцы|0.0
621|Какие ученые изучают недавние или окамененные скелетные скелет, остается для того, чтобы найти следы древних заболеваний?|Микологи|Парапсихологи|Палеопатологи|2.0
622|Люди, которые страдают от этого состояния, имеют тенденцию быть саморазрушающими. Они могут использовать наркотики или участвовать в беспорядочной сексуальной деятельности.|Обсуждающее компульсивное расстройство|Паническое расстройство|Пограничное расстройство личности|2.0
623|Люди с этим расстройством взаимодействуют в идиосинкратическом поведении, например, носить нечетную шляпу каждый день или носить их штаны назад.|Антиобщественное расстройство личности|нарциссическое расстройство личности|шизотипное расстройство личности|2.0
624|Это расстройство, также известное как маниакальная депрессия, предполагает высокий риск смерти через самоубийство.Цветадическое расстройство личности|противоположное расстройство личности|Биполярное расстройство|2.0|
625|Люди, страдающие от этого психического заболевания, проявляют психиатрическое состояние как физическую жалобу.|Агорафобия|клептомания|соматизационные расстройства|2.0
626|Старые государства пословицы, нейротики строят замки в песке. Психотики живут в них. Какая из следующих расстройств не считается неврозом?|Шизовидное расстройство личности|обсессивно-компульсивное расстройство|паническое расстройство|0,0
627|Согласно статистике, какая из следующих людей, скорее всего, покончит жизнь самоубийством?|Восстановление алкоголика.|Оформленный человек среднего возраста.|Один из разведенной женщины среднего возраста, живущая в одиночестве.|1.0
628|Три из следующих четырех нарушений на самом деле разные имена для того же заболевания. Что является нечетным?|Антисоциальная личность|психопат|маньяк|2.0
629|Люди с этим расстройством имеют трудности, участвующие в повседневном человеческом взаимодействии.|Аутизм|болезнь Хантингтонов|церебральный паралич|0,0
630|Расположенный в верхней передней части грудной полости, тимус - это орган, принадлежащий к какой системе человеческого тела?|Эндокринная система|построенная система|лимфатическая система|2.0
631|У людей, какие из этих органов принадлежат к покрованной системе?|Кожа|Миндалы|Печень|0,0
632|слизь - скользкая выделение подкладки различных мембран, характерных для которой система человеческого тела?|Все эти|репродуктивная система|пищеварительная система|0,0
633|Что из следующего не является функцией системы кровообращения?Исключение нежелательных веществ|Стабилизация температуры тела|Обучение pH|0,0|
634|Эмфизема - это хроническое заболевание, влияющее на органы какой системы организма?|Дыхательная система|скелетная система|мочевая система|0,0
635|Австралопитек были ранние гоминиды, которые различались во многих отношениях от современных людей - они были короткими, и их мозг был намного меньше. В 1924 году Раймонд Дарт нашел первые останки австралопитека на этом континенте.|Африка|Австралия|Азия|0.0
636|Самый полный австралопитек скелет, челюстись Люси, был найден в 1974 году. Она была в 1,10 м (3 7) высотой и весила около 30 кг (66 фунтов). Антропологи назвали скелет после этой Люси.|Люсиль мяч из телешоу, я люблю Люси|Люси Люси Производители|Люси из песни Beatles Люси в небе с бриллиантами|2.0
637|Есть доказательства того, что синантроп Pekinensis использовал инструменты и смогли зажечь огонь. К сожалению, зубы синантропа все еще считаются медицины и продаются в некоторых аптеках в своей родной стране.|Китай|Зимбабве|Франция|0.0
638|Около 230 000 лет назад появился один очень сложный и относительно умный вид родного рода; Homo Neanderthalus был очень хорошо адаптирован к холоду - это было коротко и мускулистые (многие современные чемпионы тяжелого веса завидуют среднему неандерталью) иБольшой нос. В 1983 году была обнаружена гийоидная кость неандертала и подняла много споров. Что доказывает эта крошечная кость?Этот неандертальцы были каннибалами|что неандертальцы, вероятно, имели сложный язык|что они, возможно, более умные, чем современные люди|1.0|
639|Какая часть здания также является именем компьютерной системы?|Двери|Окна|Балкон|1.0
640|Какое животное может быть подключено к компьютеру USB-порт?|Собака|мышь|крыса|1.0
641|Что из этого является популярным именем базы данных?|Мечеть|Oracle|Храм|1.0
642|Какой элемент ванной комнаты также является протоколом связи?|Кисть|гель|мыло|2.0
643|Какая стена используется для защиты компьютеров в Интернете или других сетях?|Брандмауэр|деревянная стена|Brickwall|0.0
644|Каким небесным телом также является именем большого американского поставщика компьютеров, компьютерных компонентов и программного обеспечения?|Солнце|Венера|Луна|0.0
645|Какое коммерческое здание также может хранить данные?|Склад|Супер рынок|Магазин|0.0
646|Какая шляпа - это распределение операционной системы Linux?|Черная шляпа|белая шляпа|красная шляпа|2.0
647|Название того, какой остров также является компьютерным языком программирования?|Куба|Ямайка|Java|2.0
648|Сколько костей (в среднем) содержат человеческое тело?|207|206|208|1.0
649|Этот чрезвычайно жизненно важный нерв отвечает за такие разнообразные задания, как частоту сердечных сокращений, желудочно-кишечный перистальтис и потливость. Он также контролирует довольно много мышечных движений во рту, включая речь и сохраняющую гортань, открытый для дыхания.|Oculomotor нерв|блуждающий нерв|нервный нерв|1.0
650|Этот орган, являющийся самой большой железой в организме человека, играет важную роль в метаболизме и имеет различные функции, включая хранение гликогена, синтез белка плазмы и детоксикацию лекарств.|Желчный мочевой пузырь|поджелудочная железа|печень|2.0
651|Диартрозные соединения разрешают различные движения и могут быть разделены на шесть классов. Соединение бедренной кости и бедра будет считаться, какой класс совместного использования?|Шарно-разъемное соединение (энартроз, сфероидальный сустав)|шарнирное соединение (сравочет)|поворотное соединение (тромхоидное соединение, поворотное соединение)|0,0
652|Что такое единственный номер без взаимного?|1|-1|0|2.0
653|Octo - это префикс, что означает восемь. Осьминог имеет восемь ног. Октаугон имеет ровно 8 сторон. Окт-восьмостанец не менее 8 десятилетий. Какой восьмой месяц?|Ноябрь|август|октябрь|1.0
654|Теория тектоники плиты объясняет движение литосферных пластин. Тектоника исходит от греческого слова Tekton, что означает.|тот, кто уничтожает|тот, кто строит|тот, кто плавает|1.0
655|Масштаб Mercalli классифицирует интенсивность землетрясений, изучая этот аспект.|Энергия - землетрясение генерирует|степень сдвига в экваторе|эффекты землетрясения на людей и структуры|2.0
656|Сейсмические волны классифицируются в четырех типах - P-волны (первичные), S-волны (вторичные), влюбленные волны (поверхностные волны) и этот тип.|F-волны|L-волны|Rayleigh Waves|2.0
657|Это землетрясение произошло 17 августа 1999 года и имела величину 7,4. Предполагаемое количество жертв составляло около 17 000 человек. Где произошла эта катастрофа?|Китай|Испания|Турция|2.0
658|Мать родит такого рода близнецов, если одно оплодотворенное яйцо разбивается после концепции.|Монозиготические близнецы|дизыготические близнецы|объединенные близнецы|0,0
659|Первая записанная успешная операция для отделения пары объединенных близнецов произошла в этом году.|1889|1976|1689|2.0
660|Скорее всего, наличие близнецов в 21 веке ...?|15 в 100|3 в 100|10 в 100|1.0
661|Двухместный плод, который не развивается во время беременности, называется этим.|Объединенные близнецы|исчезновение близнецов|несколько двойных|1.0
662|Семья Федора Васильева из России имела рекордное количество детей. Его жена родила это количество двухметных пар.|28|16|9|1.0
663|Говорят, что близнецы развивают свой собственный язык, называется этим.|Idioglossia|Синдарин|Квения|0.0
664|Если доктор предусматривает лекарство и рецепту читает, приуки на 2 - 3 GTTS в ставку OD. Что означает OD?|Левое ухо|правое ухо|правый глаз|2.0
665|Какого цвета артериальная кровь?|Фиолетовый|ярко-красный|красноватый фиолетовый|1.0
666|Какая доля в мозге отвечает за сохранение устной памяти?|Левая париетальная доля|левая височная доля|правая височная доля|1.0
667|Какие из следующих расстройств не имеют эндокринной системы?|Болезнь паркинсонов|гипертиреоз|диабет|0.0
668|Какая часть глаз захватывает световые лучи и преобразует лучи в электрические импульсы?|Сетчатка|ирис|роговица|0.0
669|Ileum находится в этой части тела.|Тонкая кишка|спинной мозг|мозг|0.0
670|Эта страна имеет больше интернет-провайдеров, чем любая другая неанглоязычная страна.|Россия|Чешская Республика|Румыния|1.0
671|Разработка глобальной компьютерной сети была впервые предложена в этом году, J.c.r. licslider.|1972|1982|1962|2.0
672|Это был первый популярный браузер WWW. Microsoft Internet Explorer также основан на нем.|Opera|Lynx|NCSA Mosaic|2.0
673|Это был предшественник интернета и первая большая географически разделенная сеть.|Arpanet|nsfnet|UUCP|0.0
674|Этот человек писал http, язык, в котором браузеры и веб-серверы общаются.|Стив Джобс|Билл Гейтс|Тим Бернерс-Ли|2.0
675|Вот как долго пробил Интернет, чтобы привлечь 50 миллионов пользователей.|4 года|20 лет|10 лет|0.0
