|question|ps_0|ps_1|ps_2|right_answer_id
0|Одним из остатков этого государства прежний статус как владение Францией является тот факт, что он был назван в честь французского короля.|Оклахома|Флорида|Луизиана|2.0
1|Самое большое озеро в этом штате - озеро окехоби. Государство также является домом для одного из двух естественных круглых озер в мире.|Гавайи|Теннесси|Флорида|2.0
2|Какая государственная столица Вашингтона?|Олимпия|Сиэтл|Walla Walla|0.0
3|Какова государственная столица Калифорнии?|Сакраменто|Лос-Анджелес|Сан-Диего|0.0
4|Что такое государственная столица Айдахо?|Бойсе|Айдахо-Фолс|Покателло|0.0
5|Какая государственная столица Невады?|Reno|Лас-Вегас|Carson City|2.0
6|Что такое государственная столица Аризоны?|Феникс|Кингман|Тусон|0.0
7|Какова государственная столица Аляски?|Kodiak|Juneau|Анкоридж|1.0
8|Во время Второй мировой войны эта страна смогла успешно защищать свою свободу и противостоять вторжениям Советского Союза - несмотря на некоторую потерю территории. Он присоединился к Европейскому союзу в 1995 году.|Польша|Чехия|Финляндия|2.0
9|Когда-то был Центр власти для империи. Оккупирован союзниками в 1945 году, государственный договор завершил свою профессию в 1955 году и признал свою независимость.|Бельгия|Дания|Австрия|2.0
10|Эта страна дома до самого северного капитала в материковой Европе?|Швеция|Дания|Финляндия|2.0
11|Это шестая по величине страна и дом доктора ветерок.|Украина|Канада|Австралия|2.0
12|Его трехлетнее социалистическое правительство было свергнуто в 1973 году диктаторским военным режимом во главе с Аугуоном Пиношем.|Перу|Парагвай|Чили|2.0
13|Эта страна доминирует в эгическом море и обладает архипелагом около 2000 островов.|Италия|Кипр|Греция|2.0
14|Эта страна контролирует полуостровом Синай. После завершения Суэцкого канала в 1869 году стало важным мировым транспортным центром.|Таиланд|Египет|Гонконг|1.0
16|Первая американская столица. У него есть ник-имя, придуманное музыкантами - это значит играть большое время.|Washington D.C.|нью-йорк|Бостон|1.0
17|Кабельные автомобили этого города - единственный мобильный национальный памятник.|Оклахома|Сан-Франциско|Невада|1.0
18|Этот город - единственный, кто расположен на двух континентах.|Кадис|Стамбул|Танджер|1.0
19|Один из самых выдающихся достопримечательностей города этого города - это Бранденбургер (Бранденбургские ворота). Это однажды отметила границу между Востоком и Западной Германией.|Берлин|Munken|Франкфурт|0.0
20|Этот город славится своим водонациональным движением. Он был назначен сайтом всемирного наследия.|Барри|Неаполь|Венеция|2.0
21|Аппалачская тропа делит два состояния, поскольку она делает его поход через великолепный национальный парк горы. Назовите государства, которые он разделяет.|Новый Гэмпшир и Мэн. Северная Каролина и Теннесси.|Западная Вирджиния и Мэриленд.|1.0|
22|Улица Салливана (в округе Салливана) служит государственной линией, работает на восток и запад, эффективно Bi-поиск этого города в двух государствах. Назовите город и два государства.|Мемфис, Теннесси, Арканзас|Бристоль, Теннесси, Вирджиния|Латема, Мэриленд, Пенсильвания|1.0
23|Город Сан-Йидро находится в каком штате, рядом с какой границей?|California, возле границы с Мексикой.|Вашингтон, недалеко от границы с Орегоном|Калифорния, недалеко от границы с Аризоной|0,0
24|Хотя ангел падает, нести понятие о чем-то ангельском, явление названо в честь Джимми Ангела, пилота Barnstorming от Миссури, который стал современной легендой.|Аргентина|Венесуэла|Панама|1.0
25|Mount Fuji - почти идеально в форме вулкана. Это поклонялось как священная гора.|Таиланд|Китай|Япония|2.0
26|Горус Эверест был сформирован около 50 миллионов лет назад. Он поднимается в несколько метров каждый год из-за геологических сил. На границе, между которой две страны расположены?|Sumatra и China|Таиланд и Непал|Китай и Непал|2.0
27|От леса в пустыню, Гранд-каньон имеет самый экстремальный климат природы.|Мексика|Канада|США|2.0
28|Через тысячи лет существовали, Ниагарский водопад был разрушен со скоростью 4 фута (1,5 метра) в год.|Мексика|Equador|Канада|2.0
29|Название горы Килиманджаро происходит от суахили и означает гору, которая блестит.|Танзания|Зимбабве|Уругуай|0.0
30|Великий Барьерный риф состоит из многих колоний кораллов. Именно поэтому иногда называют крупнейшим живым животным в мире.|Армения|Австралия|Австрия|1.0
31|Вулкан Кракатои, вызванный самым насильственным вулканическим извержением, записанным в истории миров. В 1883 году он уничтожил 75% территории его острова.|Таиланд|Малайзия|Индонезия|2.0
32|Местные люди Батонги по имени Виктория падает Моси-ОА-Туння, которая стоит за дымом, который гром.|Малави|Зимбабве|Мозамбик|1.0
33|прозвищ государство сокровищ, это государство Запада США - это четвертый по величине в районе.|Невада|Орегон|Монтана|2.0
34|Прозвище Зеленое горное государство, это восточное государство США было принято в Союз 4 марта 1791 года.|Вермонт|Пенсильвания|Коннектикут|0.0
35|Прозвище государство Buckeye, это рождение многих президентов США, в том числе Улисс С. Грант.|Небраска|Айова|Огайо|2.0
36|Это государство США, известное как государство равенства, является домом башни дьяволов, представлена в фильме тесные встречи третьего рода.|Северная Дакота|Вайоминг|Айдахо|1.0
37|Дом в ассортименте - это государственная песня этого нами среднего запада, известное как состояние подсолнечника.|Канзас|Небраска|Индиана|0.0
38|Это государство Bluegrass принимает известную лошадь в Луисвилле, а место рождения президента Авраама Линкольна.|Кентукки|Канзас|Небраска|0.0
39|Этот вулкан, представленный в нескольких минутах ходьбы награда в 1933 году, расположен недалеко от индонезийского острова Раката, в проливе Sunda.|Ruapehu|Кракатеи|Килауэа|1.0
40|Расположенный в Танзании, это самая высокая гора Африки.|Гора Кения|Maromokotro|Гора Килиманджаро|2.0
41|Одна из самых интригующих достопримечательностей Венеции - Понте Дей Соспири, что означает это на английском языке.|Река слез|мост вздыхает|улица печали|1.0
42|Если вы думаете, что вы можете увидеть статую свободы только в Нью-Йорке, подумайте снова! Я пошел на этот огромный европейский город и увидел, что он там прямо, стоял возле Гренельского моста и глядя в сторону Атлантического океана, сталкиваясь с его большейСестра в Нью-Йорке Харбор.|Париж|Мадрид|Лондон|0.0
43|Когда я посетил этот одинокий континент, я был настолько перенесен раковинами сферической секции оперы в этом городе.|Сидней|Мельбурн|Брисбен|0.0
44|Мадрид - самый большой город и столица этой страны, чьи самые ценные природные ресурсы - почва - почти треть земли подходит для выращивания.|Испания|Португалия|Аргентина|0.0
45|Улаан Батор является столицей этой малонаселенной страны, где одомашненные животные превосходят людей.|Чили|Бразилия|Монголия|2.0
46|Столица этой страны, Сукре, прозвищена Белый город », потому что большинство колониальных зданий в центре города белые.|Боливия|Пакистан|Гондурас|0.0
47|Эта страна о размере Калифорнии, но имеет около одного -Sixth от своего населения. Его столица - Асунсьон.|Куба|Парагвай|Перу|1.0
48|Вьентьян является столицей этой страны, которая имеет более 50 этнических групп, разделенных на три широких категория.|Северная Корея|Вьетнам|Лаос|2.0
49|Пном печа - столица этой страны, чья официальный язык - кхмер.|Cambodia|Южный Вьетнам|Лаос|0.0
50|Вена - столица этой страны, не имеющей выхода к морю, которая стала членом Европейского союза в 1995 году.|Австралия|Бельгия|Австрия|2.0
51|Каракас является столицей этой страны, испанской колонии более 300 лет, до того, как она заявила о своей независимости в начале 19 века.|Перу|Колумбия|Венесуэла|2.0
52|В 1488 году смелый капитан по имени Bartolomew Diaz дал название накидкой штормов на самый южный африканский совет. Тем не менее, португальский король изменил название этого.|Мыс COD Bay|мыс выключателей|мыс доброй надежды|2.0
53|С помощью королевы Изабеллы Испании, Кристофор Колумбус отправился в 1492 году, используя три крошечных корабля. Один из этих кораблей не был частью экспедиции.|Санта-Мария|Пинта|Виктория|2.0
54|Какая из следующих пар (Explorer - область он обнаружил) не правильно?|Cortez - Мексика|Pizarro - Перу|Cabral - Уругвай|2.0
55|Что из следующего не было причиной великих географических открытий?|Португальский король подумал, что его адмиралы будут обманывать его, и он хотел отправить их.|Многие новые изобретения, такие как компас, помогал морякам многое.|Турки контролировали земельный маршрут в Индию. Это заставило западные страны искать альтернативымаршруты.|0,0
56|Трентон является столицей этого восточного государства.|Мэриленд|Нью-Йорк|Нью-Джерси|2.0
57|Juneau является столицей этого последнего пограничного государства.|Юта|Аляска|Калифорния|1.0
58|Колумбус обнаружил Америку в 1492 году и вознагражден этим средним западным государством, имеющим его капитал после него.|Северная Каролина|Южная Каролина|Огайо|2.0
59|Ричмонд является столицей этого государства, где родились многие президенты США.|Мэриленд|Вирджиния|Западная Вирджиния|1.0
60|Столица этого разнообразных северо-западных государств - это Салем.|Массачусетс|Орегон|Новый Гэмпшир|1.0
61|Это государство, в котором находится один из крупнейших городов мира, обладает Олбани как его капитал.|Нью-Йорк|Новая Мексика|Грузия|0.0
62|Город Джефферсон служит столицей этого среднего запаса.|Техас|Калифорния|Миссури|2.0
63|Столица этого южного государства также известна как музыкальный город.|Делавэр|Теннесси|Кентукки|1.0
64|Carson City является столицей этой битвы государства.|Аризона|Невада|Калифорния|1.0
65|Tallahassee расположен на панхандле этого южного государства и служит его столицей.|Pennsylvania|Флорида|Северная Дакота|1.0
66|Если вы находитесь в Сакраменто, столицу этого западного государства, вы находитесь в нескольких минутах езды на красивые пляжи, высокие горы с известными национальными парками и одним из самых глубоких, самых живописных озер в мире.|Аризона|Калифорния|Юта|1.0
67|Остин - столица этого государства США, которое когда-то существовало как независимая республика.|Техас|Мэн|Грузия|0.0
68|Это северо-восточное государство имеет Августу как столицу.|Новый Гэмпшир|Мэн|Пенсильвания|1.0
69|Этот южный штат имеет много пляжей, невероятного форта от революционной войны и Колумбия в качестве его столицы.|Южная Каролина|Огайо|Иллинойс|0.0
70|Этот штат среднего запада имеет Мэдисон как его капитал.|Висконсин|Индиана|Кентукки|0.0
71|Соль-Лейк-Сити, известный соленым, бесплодным пустынным озером к западу от города, был основан мормонами и является столицей этого географически разнообразного государства.|Юта|Южная Дакота|Невада|0.0
73|Вопрос|ps_0|ps_1|ps_2|right_answer_id
74|Одним из остатков этого государства прежний статус как владение Францией является тот факт, что он был назван в честь французского короля.|Оклахома|Флорида|Луизиана|2.0
75|Самое большое озеро в этом штате - озеро окехоби. Государство также является домом для одного из двух естественных круглых озер в мире.|Гавайи|Теннесси|Флорида|2.0
76|Какая государственная столица Вашингтона?|Олимпия|Сиэтл|Walla Walla|0.0
77|Какова государственная столица Калифорнии?|Сакраменто|Лос-Анджелес|Сан-Диего|0.0
78|Что такое государственная столица Айдахо?|Бойсе|Айдахо-Фолс|Покателло|0.0
79|Вопрос|ps_0|ps_1|ps_2|right_answer_id
80|Три из этих животных в гибернации. Какой из них нет?|Мышь|Слинь|лягушка|1.0
81|Три из этих видов сарают их кожу. Какой из них нет?|Пингвины|змеи|насекомые|0.0
82|Все эти животные имеют большие уши (относительно их размера), кроме одного.|Белые медведи|лисицы|летучие мыши|0,0
83|Этот процент всех змей на земле летал для людей.|10%|20%|15%|2.0
84|Змеи такого рода животных.|Травоядные|всеядные|плотоядные|2.0
85|Змеи потребляют их еду с помощью этого процесса.|Дыхание|поглощение|глотание|2.0
86|Змеи принадлежат к следующей категории.|Беспозвоночные|ящерицы|рептилии|2.0
87|Специалист в змеи называется одним из них.|Щекультерист|орнитолог|Опиолог|2.0
88|Одна из следующих змей не принадлежит семье Viperidae.|Рогатый жгут|травяная змея|Viper|1.0
89|Cobras - ядовитые змеи семейства Elapidae, которые обычно населяют регионы этих двух континентов.|Южная Америка и Азия|Азия и Африка|Азия и Австралия|1.0
90|Cobra находится на вершине пищевой цепи, только с двумя главными хищниками - один человек, а другой - это животное.|Шакал|мангуст|Lynx|1.0
91|Здесь расположены ребра Cobras.|За головой|в груди, вокруг середины тела|Cobras не имеют ребер|0.0
92|Детская кобра полностью способна защищать себя так же мало, как это много часов после рождения.|3|12|48|0.0
93|Какой тип собаки Ричард Никсон получил от Техаса, пока он был кандидатом на вице-президент?|Немецкая овчарка|кокер-спаниель|золотой ретривер|1.0
94|Как называлось компаньоном носков в Белом доме во время администрации Клинтона?|Бадди|Обувь|Бейли|0.0
95|Какие из этих президентов были самые домашние животные?|Франклин Делано Рузвельт|Теодор Рузвельт|Билл Клинтон|1.0
96|Какая порода известна как любимая порода королевы Елизаветы II?|Пограничный колли|старый английский овчарка|Уэльс Корги|2.0
97|Как называется собака отца Фразиура на TV Show в Сиэтле?|Niles|Marty|Eddie|2.0
98|Какие из этих морских млекопитающих не в списках исчезающих видов?|Фин кит|Пилотный кит|Синий кит|1.0
99|Эта исчезающая черепаха - самая большая из всех живых черепах, достигающих длины более 2,7 м (8,8 фута) и весом 900 кг (2000 фунтов).|Кожаная морская черепаха|Кемпс Ридли Черепаха|Hawksbill Sea Turtle|0.0
100|Назовите самые редкие и наиболее подверженные под угрозу всех волков.|Красный волк|Эфиопский волк|Black-Booked Wolf|0.0
101|Этот вид больших обезьян с длинными руками и красноватными волосами страдают разрушением среды обитания из-за лесозаготовки, добычи и лесных пожаров.|Горилла|Бабуины|Орангутан|2.0
102|Что такое естественная среда обитания снега леопарда, которое было охотиться за его красивый мех, в результате чего его население снизилось до 1000 животных в 1960-х годах?|Северная Америка|Центральная Азия и Северная Америка|Центральная Азия|2.0
103|Это пресноводное млекопитающее, найденное только в реке Янцзы, является наиболее исчезновенным (даже вымершим) китацентом и одним из самых угроза находящихся под угрозой исчезающих видов в мире.|Ганг Река Дельфин|Китайская река Дельфин|La Plata Dolphin|1.0
104|Джек-джемпер муравьи, желтовато-оранжевые плотоядные муравьеды имени их характерных прыгуных движений, можно найти только на каком континенте?|Северная Америка|Австралия|Африка|1.0
105|Какая из этих животных плавает самой быстрее?|Keblunder|акула|дельфин|2.0
106|Какое слово ссылается на звуковые павлины?|Кричать|Squill|Squeak|0.0
107|Древние японцы думали, что это животное вызвало землетрясениями.|Птицы|пауки|змеи|1.0
108|Сколько типов летучих мышей?|900|700|500|0.0
109|Что самое быстрое животное на 6 ногах?|Ladybug|таракан|жук|1.0
110|Что такое женские овцы называются или известны как?|EWE|Colt|Flece|0.0
